,Type,Title,Links,Price,Discount_percent,Sold,Preview,Location,Original,Ship_price,Return,Positive_review,Ship_on_time,Rate_response,One_star,Two_star,Three_star,Four_star,Five_star
0,quần áo nam,Bộ Đồ Nam Mùa Hè Áo Thun Tay Lỡ Unisex Quần Short Kẻ 3 Sọc Ngang Thời Trang Yodi QA NAM 133,https://www.lazada.vn/products/bo-do-nam-mua-he-ao-thun-tay-lo-unisex-quan-short-ke-3-soc-ngang-thoi-trang-yodi-qa-nam-133-i2186682931.html,55.000 ₫,61% Off,5.9K Đã bán,(1666),Hà Nội,142.200 ₫,32.700 ₫,3 ngày trả hàng cho Nhà bán hàng,87%,100%,95%,81,28,51,88,1419
1,quần áo nam,Bộ thun nam cổ tròn mặc hè chất liệu vân gạo dập nổi cao cấp phong cách trẻ trung Soyoung MQA 053,https://www.lazada.vn/products/bo-thun-nam-co-tron-mac-he-chat-lieu-van-gao-dap-noi-cao-cap-phong-cach-tre-trung-soyoung-mqa-053-i2592507498.html,39.082 ₫,60% Off,413 Đã bán,(172),Hà Nội,98.000 ₫,38.000 ₫,3 ngày trả hàng cho Nhà bán hàng,65%,100%,79%,61,3,0,0,107
2,quần áo nam,[ Hoàn Tiền 15% ] Set Bộ Quần Áo Thun Hè Nam Mẫu Mới In Họa Tiết Chữ LXSU Phối Màu Phong Cách Thời Trang C-CHAT MEN QA 129 V2,https://www.lazada.vn/products/hoan-tien-15-set-bo-quan-ao-thun-he-nam-mau-moi-in-hoa-tiet-chu-lxsu-phoi-mau-phong-cach-thoi-trang-c-chat-men-qa-129-v2-i1371864388.html,28.698 ₫,63% Off,2.9K Đã bán,(1580),Hà Nội,90.000 ₫,38.000 ₫,3 ngày trả hàng cho Nhà bán hàng,68%,100%,75%,145,23,10,9,1393
3,quần áo nam,ĐỒ BỘ THỂ THAO GẤU TRÚC PAN.DA SET ĐỒ BỘ THỂ THAO ĐỒ BỘ TẬP GYM MANG Ở NHÀ VÀ ĐI CHƠI ĐỒ BỘ NAM PHONG CÁCH CAO CẤP 2023 - DUBAI FASHION,https://www.lazada.vn/products/do-bo-the-thao-gau-truc-panda-set-do-bo-the-thao-do-bo-tap-gym-mang-o-nha-va-di-choi-do-bo-nam-phong-cach-cao-cap-2023-dubai-fashion-i1274949917.html,32.000 ₫,54% Off,7.3K Đã bán,(1504),Hồ Chí Minh,120.000 ₫,16.500 ₫,3 ngày trả hàng cho Nhà bán hàng,88%,99%,100%,126,46,65,109,1159
4,quần áo nam,ĐỒ BỘ THỂ THAO DONT STOP TRÀ SỮA SET ĐỒ BỘ THỂ THAO ĐỒ BỘ TẬP GYM MANG Ở NHÀ VÀ ĐI CHƠI ĐỒ BỘ NAM PHONG CÁCH SÀNH ĐIỆU- DUBAI FASHION,https://www.lazada.vn/products/do-bo-the-thao-dont-stop-tra-sua-set-do-bo-the-thao-do-bo-tap-gym-mang-o-nha-va-di-choi-do-bo-nam-phong-cach-sanh-dieu-dubai-fashion-i2233985477.html,29.799 ₫,57% Off,2.4K Đã bán,(624),Hồ Chí Minh,150.000 ₫,16.500 ₫,3 ngày trả hàng cho Nhà bán hàng,88%,99%,100%,N/A,N/A,N/A,N/A,N/A
5,quần áo nam,BỘ THỂ THAO MÙA THU ĐÔNG XUÂN HÈ NAM NỮ UNISEX POLO L-NING HOT TREND 2024 - DUBAI FASHION,https://www.lazada.vn/products/bo-the-thao-mua-thu-dong-xuan-he-nam-nu-unisex-polo-l-ning-hot-trend-2024-dubai-fashion-i2533085784.html,58.500 ₫,58% Off,395 Đã bán,(111),Hồ Chí Minh,200.000 ₫,16.500 ₫,3 ngày trả hàng cho Nhà bán hàng,88%,99%,100%,1,1,4,8,97
6,quần áo nam,Áo Phông Nam DSQ2 In Chữ Dominate Your Sport. Áo Thun Nam Nữ DSQUARED2 Form Dáng Unisex Dành Cho Các Boy Phố Chịu Chơi. NTD MAT 081,https://www.lazada.vn/products/ao-phong-nam-dsq2-in-chu-dominate-your-sport-ao-thun-nam-nu-dsquared2-form-dang-unisex-danh-cho-cac-boy-pho-chiu-choi-ntd-mat-081-i2592436000.html,17.370 ₫,65% Off,351 Đã bán,(151),Hà Nội,50.000 ₫,38.000 ₫,3 ngày trả hàng cho Nhà bán hàng,69%,100%,82%,51,5,2,1,92
7,quần áo nam,[ Mẫu Mới 2024 ] Bộ quần áo thun nam Bộ quần áo thun nữ Bộ quần áo thun unisex in hình mặt cười XX phong cách trẻ trung mát mẻ Zenko MQA 027,https://www.lazada.vn/products/mau-moi-2024-bo-quan-ao-thun-nam-bo-quan-ao-thun-nu-bo-quan-ao-thun-unisex-in-hinh-mat-cuoi-xx-phong-cach-tre-trung-mat-me-zenko-mqa-027-i2271930066.html,32.845 ₫,66% Off,147 Đã bán,(55),Hà Nội,98.000 ₫,38.000 ₫,3 ngày trả hàng cho Nhà bán hàng,65%,100%,85%,16,4,3,3,29
8,quần áo nam,"Bộ quần áo nam in chữ IC dệt ngực, bộ hè nam chất xịn mặc cực thoải mái phong cách trẻ trung lịch sự full size cho bạn",https://www.lazada.vn/products/bo-quan-ao-nam-in-chu-ic-det-nguc-bo-he-nam-chat-xin-mac-cuc-thoai-mai-phong-cach-tre-trung-lich-su-full-size-cho-ban-i2397750927.html,45.000 ₫,50% Off,261 Đã bán,(139),Hà Nội,90.000 ₫,32.700 ₫,3 ngày trả hàng cho Nhà bán hàng,99%,98%,100%,1,0,1,0,137
9,quần áo nam,[có video] Áo thun nam thêu logo VL cực đẹp chuẩn thời trang hiện nay hàng shop,https://www.lazada.vn/products/co-video-ao-thun-nam-theu-logo-vl-cuc-dep-chuan-thoi-trang-hien-nay-hang-shop-i737984995.html,45.133 ₫,72% Off,534 Đã bán,(133),Hồ Chí Minh,159.000 ₫,16.500 ₫,3 ngày trả hàng cho Nhà bán hàng,95%,97%,80%,4,1,1,2,125
10,quần áo nam,Bộ Đồ Nam Mùa Hè Áo Thun Tay Lỡ Cổ Tròn Quần Short Loang Màu Họa Tiết Thời Trang Yodi QA NAM 136,https://www.lazada.vn/products/bo-do-nam-mua-he-ao-thun-tay-lo-co-tron-quan-short-loang-mau-hoa-tiet-thoi-trang-yodi-qa-nam-136-i2186698825.html,55.000 ₫,61% Off,3.2K Đã bán,(876),Hà Nội,142.200 ₫,32.700 ₫,3 ngày trả hàng cho Nhà bán hàng,87%,100%,95%,47,11,18,26,774
11,quần áo nam,Bộ Đồ Nam Nữ Unisex Mùa Hè Ngắn Tay Cổ Tròn Họa Tiết Loang Vẩy Sơn Hot Trend Thời Trang Yodi QA NAM 104,https://www.lazada.vn/products/bo-do-nam-nu-unisex-mua-he-ngan-tay-co-tron-hoa-tiet-loang-vay-son-hot-trend-thoi-trang-yodi-qa-nam-104-i1653952108.html,55.000 ₫,62% Off,6.2K Đã bán,(1542),Hà Nội,146.150 ₫,32.700 ₫,3 ngày trả hàng cho Nhà bán hàng,87%,100%,95%,49,27,37,54,1375
12,quần áo nam,M62 - BỘ MANCHESTER CITY - QUẦN ÁO THỂ THAO LONG THANH,https://www.lazada.vn/products/m62-bo-manchester-city-quan-ao-the-thao-long-thanh-i2422653864.html,26.350 ₫,20% Off,3.2K Đã bán,(1181),Hồ Chí Minh,31.000 ₫,16.500 ₫,3 ngày trả hàng cho Nhà bán hàng,99%,100%,100%,3,2,2,13,1160
13,quần áo nam,M58 - BỘ ARSENAL - QUẦN ÁO THỂ THAO LONG THANH,https://www.lazada.vn/products/m58-bo-arsenal-quan-ao-the-thao-long-thanh-i2422592615.html,26.350 ₫,15% Off,4.5K Đã bán,(1655),Hồ Chí Minh,57.000 ₫,16.500 ₫,3 ngày trả hàng cho Nhà bán hàng,99%,100%,100%,5,1,9,22,1618
14,quần áo nam,Bộ Đồ Nam Cao Cấp Mặc Nhà Chất Tổ Ong Bộ Thể Thao Chất Cotton Mềm Mịn Thêu N.Y Siêu Đẹp BO09 - MINHSTORE,https://www.lazada.vn/products/bo-do-nam-cao-cap-mac-nha-chat-to-ong-bo-the-thao-chat-cotton-mem-min-theu-ny-sieu-dep-bo09-minhstore-i2232441461.html,89.000 ₫,51% Off,9.2K Đã bán,(1672),Hà Nội,180.000 ₫,32.700 ₫,3 ngày trả hàng cho Nhà bán hàng,96%,99%,94%,24,14,23,52,1555
15,quần áo nam,Bộ Đồ Nam Mùa Hè Áo Thun Tay Lỡ Cổ Tròn Phối Quần Short Thể Thao Họa Tiết Chữ Caro Thời Trang Yodi TOP 277 + SHORT 058,https://www.lazada.vn/products/bo-do-nam-mua-he-ao-thun-tay-lo-co-tron-phoi-quan-short-the-thao-hoa-tiet-chu-caro-thoi-trang-yodi-top-277-short-058-i2357229496.html,55.000 ₫,61% Off,3.4K Đã bán,(1143),Hà Nội,142.000 ₫,32.700 ₫,3 ngày trả hàng cho Nhà bán hàng,87%,100%,95%,37,13,23,34,1035
16,quần áo nam,Bộ Đồ Nam Mùa Hè Áo Thun Tay Lỡ Kèm Quần Short Họa Tiết Caro N_Y Thời Trang Yodi TOP 269 + SHORT 052,https://www.lazada.vn/products/bo-do-nam-mua-he-ao-thun-tay-lo-kem-quan-short-hoa-tiet-caro-n_y-thoi-trang-yodi-top-269-short-052-i2324862674.html,55.000 ₫,61% Off,1.5K Đã bán,(443),Hà Nội,142.200 ₫,32.700 ₫,3 ngày trả hàng cho Nhà bán hàng,87%,100%,95%,10,11,10,16,396
17,quần áo nam,M77 - BỘ QUẦN ÁO THỂ THAO - CLB REAL MADRID - LONG THANH,https://www.lazada.vn/products/m77-bo-quan-ao-the-thao-clb-real-madrid-long-thanh-i2422585644.html,26.350 ₫,20% Off,4.7K Đã bán,(1603),Hồ Chí Minh,57.000 ₫,16.500 ₫,3 ngày trả hàng cho Nhà bán hàng,99%,100%,100%,12,3,5,27,1556
18,quần áo nam,"[Freeshipmax] Bộ thun nam, Bộ hè nam Tomi Mẫu Mới Cực Đẹp, Chất Thun Lạnh Co dãn 4 chiều",https://www.lazada.vn/products/freeshipmax-bo-thun-nam-bo-he-nam-tomi-mau-moi-cuc-dep-chat-thun-lanh-co-dan-4-chieu-i2411805541.html,80.000 ₫,60% Off,26 Đã bán,(5),Hà Nội,199.000 ₫,32.700 ₫,3 ngày trả hàng cho Nhà bán hàng,99%,Không đủ thông tin,Không đủ thông tin,0,0,0,0,5
19,quần áo nam,[Tặng Vòng Tay Dễ Thương]Đồ bộ thể thao nam set bộ thể thao nam siêu đẹp bộ thể thao nam tập gym siêu hot mẫu mới,https://www.lazada.vn/products/tang-vong-tay-de-thuongdo-bo-the-thao-nam-set-bo-the-thao-nam-sieu-dep-bo-the-thao-nam-tap-gym-sieu-hot-mau-moi-i375000494.html,40.306 ₫,60% Off,5.1K Đã bán,(824),Hồ Chí Minh,100.000 ₫,16.500 ₫,3 ngày trả hàng cho Nhà bán hàng,92%,100%,66%,49,15,33,41,686
20,quần áo nam,[Tặng Vòng Tay Dễ Thương]Đồ bộ thể thao nam mẫu mới mùa hè siêu hot chất thun lạnh cao cấp thấm hút mồ hôi sét thể thao nam LOANG SIÊU CHẤT,https://www.lazada.vn/products/tang-vong-tay-de-thuongdo-bo-the-thao-nam-mau-moi-mua-he-sieu-hot-chat-thun-lanh-cao-cap-tham-hut-mo-hoi-set-the-thao-nam-loang-sieu-chat-i1871786558.html,63.065 ₫,47% Off,2.8K Đã bán,(476),Hồ Chí Minh,120.000 ₫,16.500 ₫,3 ngày trả hàng cho Nhà bán hàng,92%,100%,66%,12,1,6,22,435
21,quần áo nam,ĐỒ BỘ THỂ THAO DONT STOP TRÀ SỮA SET ĐỒ BỘ THỂ THAO ĐỒ BỘ TẬP GYM MANG Ở NHÀ VÀ ĐI CHƠI ĐỒ BỘ NAM PHONG CÁCH HOT NHẤT 2023 - DUBAI FASHION,https://www.lazada.vn/products/do-bo-the-thao-dont-stop-tra-sua-set-do-bo-the-thao-do-bo-tap-gym-mang-o-nha-va-di-choi-do-bo-nam-phong-cach-hot-nhat-2023-dubai-fashion-i2233994476.html,33.000 ₫,53% Off,2.0K Đã bán,(494),Hồ Chí Minh,150.000 ₫,16.500 ₫,3 ngày trả hàng cho Nhà bán hàng,88%,99%,100%,N/A,N/A,N/A,N/A,N/A
22,quần áo nam,ĐỒ BỘ THỂ THAO 3 SỌC SÀNH ĐIỆU SET ĐỒ BỘ THỂ THAO ĐỒ BỘ TẬP GYM MANG Ở NHÀ VÀ ĐI CHƠI ĐỒ BỘ NAM NỮ PHONG CÁCH CAO CẤP - DUBAI FASHION,https://www.lazada.vn/products/do-bo-the-thao-3-soc-sanh-dieu-set-do-bo-the-thao-do-bo-tap-gym-mang-o-nha-va-di-choi-do-bo-nam-nu-phong-cach-cao-cap-dubai-fashion-i1345833562.html,32.000 ₫,54% Off,432 Đã bán,(99),Hồ Chí Minh,140.000 ₫,16.500 ₫,3 ngày trả hàng cho Nhà bán hàng,88%,99%,100%,11,2,4,1,81
23,quần áo nam,Bộ thể thao nam BH37 chất liệu thun lạnh cao cấp co dãn 4 chiều trẻ trung năng động,https://www.lazada.vn/products/bo-the-thao-nam-bh37-chat-lieu-thun-lanh-cao-cap-co-dan-4-chieu-tre-trung-nang-dong-i1949322434.html,59.000 ₫,50% Off,1.0K Đã bán,(199),Hà Nội,118.000 ₫,32.700 ₫,3 ngày trả hàng cho Nhà bán hàng,93%,100%,100%,7,4,4,9,175
24,quần áo nam,"[FeeshipMax] Đồ bộ nam, Bộ hè nam Iconn Quần 2D Siêu Đẹp, Chất liệu thun lạnh co dãn 4 chiều",https://www.lazada.vn/products/feeshipmax-do-bo-nam-bo-he-nam-iconn-quan-2d-sieu-dep-chat-lieu-thun-lanh-co-dan-4-chieu-i2395055702.html,78.000 ₫,40% Off,679 Đã bán,(190),Hà Nội,129.000 ₫,32.700 ₫,3 ngày trả hàng cho Nhà bán hàng,97%,99%,50%,6,3,3,3,175
25,quần áo nam,"[FeeshipMax] Đồ bộ nam, Bộ hè nam L.A Đỏ Siêu Đẹp, Chất liệu thun lạnh co dãn 4 chiều",https://www.lazada.vn/products/feeshipmax-do-bo-nam-bo-he-nam-la-do-sieu-dep-chat-lieu-thun-lanh-co-dan-4-chieu-i2635457096.html,75.530 ₫,53% Off,36 Đã bán,(9),Hà Nội,159.000 ₫,32.700 ₫,3 ngày trả hàng cho Nhà bán hàng,97%,99%,50%,1,0,0,0,9
26,quần áo nam,[ Hoàn Tiền 15% ] Bộ Quần Áo Nam Ngắn Hot Hit Họa Tiết Chữ Phối Màu Loang Sành Điệu Kiểu Dáng Thể Thao Trẻ Trung Năng Động C-Chat QA NAM CC124C,https://www.lazada.vn/products/hoan-tien-15-bo-quan-ao-nam-ngan-hot-hit-hoa-tiet-chu-phoi-mau-loang-sanh-dieu-kieu-dang-the-thao-tre-trung-nang-dong-c-chat-qa-nam-cc124c-i754820138.html,32.845 ₫,58% Off,94 Đã bán,(37),Hà Nội,90.000 ₫,38.000 ₫,3 ngày trả hàng cho Nhà bán hàng,68%,100%,75%,15,1,0,0,21
27,quần áo nam,[ Mẫu Mới 2024 ] Bộ Quần Áo Thun Thời Trang Nam Áo Ngắn Tay Cổ Tròn Họa Tiết Ba Sọc Màu Nhỏ THE COME MUSIC Kiểu Dáng Trẻ Trung Năng Động Zenko MEN QA 098,https://www.lazada.vn/products/mau-moi-2024-bo-quan-ao-thun-thoi-trang-nam-ao-ngan-tay-co-tron-hoa-tiet-ba-soc-mau-nho-the-come-music-kieu-dang-tre-trung-nang-dong-zenko-men-qa-098-i1820661377.html,31.161 ₫,60% Off,907 Đã bán,(510),Hà Nội,90.000 ₫,38.000 ₫,3 ngày trả hàng cho Nhà bán hàng,65%,100%,85%,40,3,5,12,450
28,quần áo nam,Bộ quần áo nam mùa hè GG48,https://www.lazada.vn/products/bo-quan-ao-nam-mua-he-gg48-i2580475778.html,48.000 ₫,68% Off,182 Đã bán,(36),Hà Nội,150.000 ₫,32.700 ₫,3 ngày trả hàng cho Nhà bán hàng,85%,98%,66%,3,0,1,0,32
29,quần áo nam,"Bộ quần áo nam mùa hè Icon đen, trắng",https://www.lazada.vn/products/bo-quan-ao-nam-mua-he-icon-den-trang-i2587663322.html,48.000 ₫,68% Off,158 Đã bán,(47),Hà Nội,150.000 ₫,32.700 ₫,3 ngày trả hàng cho Nhà bán hàng,85%,98%,66%,4,1,2,0,40
30,quần áo nam,"Bộ hè nam in icon và lá, bộ hè nam phong cách thời trang trẻ chất vải cao cấp mặc cực thoải mái thoáng mát đủ size cho bạn",https://www.lazada.vn/products/bo-he-nam-in-icon-va-la-bo-he-nam-phong-cach-thoi-trang-tre-chat-vai-cao-cap-mac-cuc-thoai-mai-thoang-mat-du-size-cho-ban-i2642259355.html,45.133 ₫,50% Off,29 Đã bán,(20),Hà Nội,150.000 ₫,32.700 ₫,3 ngày trả hàng cho Nhà bán hàng,98%,99%,100%,1,0,0,0,19
31,quần áo nam,"[FreeshipMax] Đồ bộ nam, Bộ hè nam in hình mặt cười Siêu Đẹp, Chất liệu thun lạnh co dãn 4 chiều",https://www.lazada.vn/products/freeshipmax-do-bo-nam-bo-he-nam-in-hinh-mat-cuoi-sieu-dep-chat-lieu-thun-lanh-co-dan-4-chieu-i2569567696.html,48.000 ₫,76% Off,81 Đã bán,(25),Hà Nội,199.000 ₫,32.700 ₫,3 ngày trả hàng cho Nhà bán hàng,97%,99%,50%,0,0,0,0,25
32,quần áo nam,"[FeeshipMax] Đồ bộ nam, Bộ hè nam ToMy Siêu Đẹp, Chất liệu thun lạnh co dãn 4 chiều",https://www.lazada.vn/products/feeshipmax-do-bo-nam-bo-he-nam-tomy-sieu-dep-chat-lieu-thun-lanh-co-dan-4-chieu-i2411590711.html,78.000 ₫,69% Off,302 Đã bán,(111),Hà Nội,250.000 ₫,32.700 ₫,3 ngày trả hàng cho Nhà bán hàng,97%,99%,50%,0,0,2,2,107
33,quần áo nam,ĐỒ BỘ THỂ THAO LOGO AI CẬP PHẢN QUANG SET ĐỒ BỘ THỂ THAO ĐỒ BỘ TẬP GYM MANG Ở NHÀ VÀ ĐI CHƠI ĐỒ BỘ NAM PHONG CÁCH CAO CẤP MỚI - DUBAI FASHION,https://www.lazada.vn/products/do-bo-the-thao-logo-ai-cap-phan-quang-set-do-bo-the-thao-do-bo-tap-gym-mang-o-nha-va-di-choi-do-bo-nam-phong-cach-cao-cap-moi-dubai-fashion-i2366295470.html,33.000 ₫,53% Off,289 Đã bán,(102),Hồ Chí Minh,150.000 ₫,16.500 ₫,3 ngày trả hàng cho Nhà bán hàng,88%,99%,100%,4,1,5,4,88
34,quần áo nam,Đồ bộ thể thao nam mẫu in logo thời trang hiện đại Phong cách Hàn Quốc Slim Fit mặc nhà đi chơi đều đẹp,https://www.lazada.vn/products/do-bo-the-thao-nam-mau-in-logo-thoi-trang-hien-dai-phong-cach-han-quoc-slim-fit-mac-nha-di-choi-deu-dep-i1819252368.html,25.000 ₫,77% Off,1.9K Đã bán,(406),Hồ Chí Minh,109.000 ₫,16.500 ₫,3 ngày trả hàng cho Nhà bán hàng,92%,100%,50%,15,7,11,14,359
35,quần áo nam,ĐỒ BỘ THỂ THAO MA JOURNEY SET ĐỒ BỘ THỂ THAO ĐỒ BỘ TẬP GYM MANG Ở NHÀ VÀ ĐI CHƠI ĐỒ BỘ NAM PHONG CÁCH ĐẲNG CẤP NEW HOT 2023 - DUBAI FASHION,https://www.lazada.vn/products/do-bo-the-thao-ma-journey-set-do-bo-the-thao-do-bo-tap-gym-mang-o-nha-va-di-choi-do-bo-nam-phong-cach-dang-cap-new-hot-2023-dubai-fashion-i1536733991.html,30.000 ₫,63% Off,2.3K Đã bán,(475),Hồ Chí Minh,150.000 ₫,16.500 ₫,3 ngày trả hàng cho Nhà bán hàng,88%,99%,100%,N/A,N/A,N/A,N/A,N/A
36,quần áo nam,Áo thun nam tay ngắn cổ tròn phối logo cực đẹp vải cotton co dãn 4 chiều form chuẩn 2 màu cao cấp mẫu mới - NEWSTYLE,https://www.lazada.vn/products/ao-thun-nam-tay-ngan-co-tron-phoi-logo-cuc-dep-vai-cotton-co-dan-4-chieu-form-chuan-2-mau-cao-cap-mau-moi-newstyle-i2195639903.html,39.000 ₫,56% Off,163 Đã bán,(39),Hồ Chí Minh,89.000 ₫,16.500 ₫,3 ngày trả hàng cho Nhà bán hàng,95%,82%,76%,N/A,N/A,N/A,N/A,N/A
37,quần áo nam,Bộ đồ nam thể thao có cổ BT CỔ BẺ cao cấp Chất liệu thun lạnh 4 chiều phong cách thể thao 2 màu trắng đen full size từ 35-85kg,https://www.lazada.vn/products/bo-do-nam-the-thao-co-co-bt-co-be-cao-cap-chat-lieu-thun-lanh-4-chieu-phong-cach-the-thao-2-mau-trang-den-full-size-tu-35-85kg-i1242614078.html,59.000 ₫,34% Off,1.3K Đã bán,(223),Hà Nội,150.000 ₫,32.700 ₫,3 ngày trả hàng cho Nhà bán hàng,93%,100%,100%,N/A,N/A,N/A,N/A,N/A
38,quần áo nam,"[Freeshipmax] Bộ thun nam, Bộ hè nam Phối Diorr Chất Đẹp, Chất Thun Co dãn 4C",https://www.lazada.vn/products/freeshipmax-bo-thun-nam-bo-he-nam-phoi-diorr-chat-dep-chat-thun-co-dan-4c-i2200315267.html,49.000 ₫,62% Off,36 Đã bán,(20),Hà Nội,130.000 ₫,32.700 ₫,3 ngày trả hàng cho Nhà bán hàng,99%,Không đủ thông tin,Không đủ thông tin,0,0,0,0,20
39,quần áo nam,Đồ bộ nam M.zero mặc nhà thể thao tập gym gồm áo thun và quần short đùi có túi tiện lợi siêu mát mùa hè nam nữ mặc đều đẹp - Top1shop 01,https://www.lazada.vn/products/do-bo-nam-mzero-mac-nha-the-thao-tap-gym-gom-ao-thun-va-quan-short-dui-co-tui-tien-loi-sieu-mat-mua-he-nam-nu-mac-deu-dep-top1shop-01-i1547588367.html,19.369 ₫,89% Off,2.4K Đã bán,(491),Hồ Chí Minh,175.000 ₫,16.500 ₫,3 ngày trả hàng cho Nhà bán hàng,92%,98%,100%,3,3,15,14,456
40,quần áo nam,ĐỒ BỘ THỂ THAO KIẾM NHẬT SET ĐỒ BỘ THỂ THAO ĐỒ BỘ TẬP GYM MANG Ở NHÀ VÀ ĐI CHƠI ĐỒ BỘ NAM PHONG CÁCH CAO CẤP 2023 - DUBAI FASHION,https://www.lazada.vn/products/do-bo-the-thao-kiem-nhat-set-do-bo-the-thao-do-bo-tap-gym-mang-o-nha-va-di-choi-do-bo-nam-phong-cach-cao-cap-2023-dubai-fashion-i1392560650.html,32.000 ₫,54% Off,4.5K Đã bán,(945),Hồ Chí Minh,140.000 ₫,16.500 ₫,3 ngày trả hàng cho Nhà bán hàng,88%,99%,100%,60,17,28,49,791
41,quần áo nam,[Freeship MAX] Áo Thun Nam Mùa Hè Tay Ngắn Cổ Tròn Họa Tiết Phong Cảnh Núi Rừng GANENX Phối Màu Ombre Độc Đáo Phong Cách Trẻ Trung Cá Tính Thời Trang Rich Man MEN TOP 222,https://www.lazada.vn/products/freeship-max-ao-thun-nam-mua-he-tay-ngan-co-tron-hoa-tiet-phong-canh-nui-rung-ganenx-phoi-mau-ombre-doc-dao-phong-cach-tre-trung-ca-tinh-thoi-trang-rich-man-men-top-222-i1371910128.html,13.027 ₫,74% Off,1.4K Đã bán,(580),Hà Nội,50.000 ₫,38.000 ₫,3 ngày trả hàng cho Nhà bán hàng,66%,100%,81%,111,8,4,6,451
42,quần áo nam,Quần Áo Thun Nam - bộ quần áo nam in hình 3 sọc trắng,https://www.lazada.vn/products/quan-ao-thun-nam-bo-quan-ao-nam-in-hinh-3-soc-trang-i1943454365.html,62.831 ₫,43% Off,849 Đã bán,(173),Nam Định,110.000 ₫,37.700 ₫,3 ngày trả hàng cho Nhà bán hàng,95%,100%,100%,7,1,5,11,149
43,quần áo nam,"ĐỒ BỘ THỂ GẤU PHI HÀNH GIA MTAG, SET ĐỒ BỘ THỂ THAO, ĐỒ BỘ TẬP GYM. CHƠI BÓNG RỔ MANG Ở NHÀ VÀ ĐI CHƠI , ĐỒ BỘ NAM PHONG CÁCH HOT NHẤT 2023 - TOKYO FASHION",https://www.lazada.vn/products/do-bo-the-gau-phi-hanh-gia-mtag-set-do-bo-the-thao-do-bo-tap-gym-choi-bong-ro-mang-o-nha-va-di-choi-do-bo-nam-phong-cach-hot-nhat-2023-tokyo-fashion-i2187350586.html,32.000 ₫,54% Off,178 Đã bán,(36),Hồ Chí Minh,150.000 ₫,16.500 ₫,3 ngày trả hàng cho Nhà bán hàng,88%,100%,98%,N/A,N/A,N/A,N/A,N/A
44,quần áo nam,ĐỒ BỘ THỂ THAO CHỮ NY SET ĐỒ BỘ THỂ THAO ĐỒ BỘ TẬP GYM MANG Ở NHÀ VÀ ĐI CHƠI ĐỒ BỘ NAM PHONG CÁCH CAO CẤP 2023 - DUBAI FASHION,https://www.lazada.vn/products/do-bo-the-thao-chu-ny-set-do-bo-the-thao-do-bo-tap-gym-mang-o-nha-va-di-choi-do-bo-nam-phong-cach-cao-cap-2023-dubai-fashion-i1396539224.html,32.000 ₫,54% Off,1.8K Đã bán,(379),Hồ Chí Minh,140.000 ₫,16.500 ₫,3 ngày trả hàng cho Nhà bán hàng,88%,99%,100%,25,15,14,15,310
45,quần áo nam,ARTSMAN Áo thun tay raglan dày dặn nam mùa hè ngoại cỡ dành cho bé trai Áo thun ngắn tay cotton nguyên chất cực rộng dáng rộng,https://www.lazada.vn/products/artsman-ao-thun-tay-raglan-day-dan-nam-mua-he-ngoai-co-danh-cho-be-trai-ao-thun-ngan-tay-cotton-nguyen-chat-cuc-rong-dang-rong-i2638781825.html,353 ₫,23% Off,147 Đã bán,,Nước ngoài,458 ₫,17.000 ₫,Được đổi ý,Nhà bán hàng mới,Không đủ thông tin,Không đủ thông tin,0,0,0,0,0
46,quần áo nam,[ Mẫu Mới 2023 ] Bộ Quần Áo Thun Nam Ngắn Tay Mùa Hè Hot Trend 2023 Họa Tiết Chữ LXSU Phối Màu Gradient Phong Cách Trẻ Trung Cá Tính Năng Động Zenko MEN QA 129,https://www.lazada.vn/products/mau-moi-2023-bo-quan-ao-thun-nam-ngan-tay-mua-he-hot-trend-2023-hoa-tiet-chu-lxsu-phoi-mau-gradient-phong-cach-tre-trung-ca-tinh-nang-dong-zenko-men-qa-129-i1362847477.html,32.845 ₫,79% Off,217 Đã bán,(92),Hà Nội,158.000 ₫,38.000 ₫,3 ngày trả hàng cho Nhà bán hàng,65%,100%,85%,15,4,2,2,69
47,quần áo nam,"[FreeshipMax] Bộ thể thao nam, Bộ hè nam chữ LA Đỏ Siêu Đẹp, Chất liệu thun lạnh co dãn 4C",https://www.lazada.vn/products/freeshipmax-bo-the-thao-nam-bo-he-nam-chu-la-do-sieu-dep-chat-lieu-thun-lanh-co-dan-4c-i2635318540.html,48.000 ₫,69% Off,34 Đã bán,(1),Hà Nội,155.000 ₫,32.700 ₫,3 ngày trả hàng cho Nhà bán hàng,96%,98%,33%,0,0,0,0,1
48,quần áo nam,Đồ bộ nam mặc nhà in hình chú mèo may mắn đồ bộ hè nam đồ tập gym nam set thể thao nam chất thun mè thấm hút 01,https://www.lazada.vn/products/do-bo-nam-mac-nha-in-hinh-chu-meo-may-man-do-bo-he-nam-do-tap-gym-nam-set-the-thao-nam-chat-thun-me-tham-hut-01-i1322657178.html,19.369 ₫,88% Off,100 Đã bán,(28),Hồ Chí Minh,165.000 ₫,16.500 ₫,3 ngày trả hàng cho Nhà bán hàng,92%,98%,100%,0,0,0,0,28
49,quần áo nam,"Bộ quần áo nam mùa hè in chữ T.b, bộ quần áo nam chất xịn mặc cực thoải mái thoáng mát mang phong cách trẻ trung thanh lịch có đủ size từ M,L,XL,XXL",https://www.lazada.vn/products/bo-quan-ao-nam-mua-he-in-chu-tb-bo-quan-ao-nam-chat-xin-mac-cuc-thoai-mai-thoang-mat-mang-phong-cach-tre-trung-thanh-lich-co-du-size-tu-mlxlxxl-i2536730485.html,45.000 ₫,50% Off,101 Đã bán,(83),Hà Nội,150.000 ₫,32.700 ₫,3 ngày trả hàng cho Nhà bán hàng,99%,98%,100%,1,0,0,1,81
50,quần áo nam,[Hoàn Tiền 20%] [ Voucher Giảm 50% ] Bộ Quần Áo Thun Nam Hot Trend 2023 Tay Ngắn Cổ Tròn Họa Tiết Hoạt Hình PIKAOEHC Phong Cách Trẻ Trung Cá Tính Năng Động Shiny Sunday MEN QA 123,https://www.lazada.vn/products/hoan-tien-20-voucher-giam-50-bo-quan-ao-thun-nam-hot-trend-2023-tay-ngan-co-tron-hoa-tiet-hoat-hinh-pikaoehc-phong-cach-tre-trung-ca-tinh-nang-dong-shiny-sunday-men-qa-123-i1211472022.html,32.845 ₫,66% Off,2.1K Đã bán,(1211),Hà Nội,98.000 ₫,38.000 ₫,3 ngày trả hàng cho Nhà bán hàng,68%,100%,82%,114,19,19,17,1042
51,quần áo nam,Bộ quần áo cổ tròn ngắn tay kèm quần short chất thun lạnh phối họa tiết trend thầy Thích Minh Tuệ 5 size nam nữ - Top1Shop,https://www.lazada.vn/products/bo-quan-ao-co-tron-ngan-tay-kem-quan-short-chat-thun-lanh-phoi-hoa-tiet-trend-thay-thich-minh-tue-5-size-nam-nu-top1shop-i2662811977.html,46.320 ₫,69% Off,29 Đã bán,(3),Hồ Chí Minh,149.000 ₫,16.500 ₫,3 ngày trả hàng cho Nhà bán hàng,92%,98%,100%,0,0,1,0,2
52,quần áo nam,[Tặng Vòng Tay Dễ Thương][HCM]Đồ bộ thể thao nam tập gym chất liệu mát mịn thấm hút mồ hôi thích hợp đi tập gym đi thể thao đi dạo,https://www.lazada.vn/products/tang-vong-tay-de-thuonghcmdo-bo-the-thao-nam-tap-gym-chat-lieu-mat-min-tham-hut-mo-hoi-thich-hop-di-tap-gym-di-the-thao-di-dao-i272738183.html,50.159 ₫,50% Off,8.0K Đã bán,(1436),Hồ Chí Minh,100.000 ₫,16.500 ₫,3 ngày trả hàng cho Nhà bán hàng,92%,100%,66%,78,21,56,78,1203
53,quần áo nam,M 94 - QUẦN ÁO THỂ THAO - LONG THANH - MANCHESTER,https://www.lazada.vn/products/m-94-quan-ao-the-thao-long-thanh-manchester-i2547415378.html,25.830 ₫,17% Off,642 Đã bán,(242),Hồ Chí Minh,31.000 ₫,16.500 ₫,3 ngày trả hàng cho Nhà bán hàng,99%,100%,100%,0,0,0,2,240
54,quần áo nam,Đồ bộ in nhiệt quần áo bóng đá bia mùa hè nam nữ unisex phong cách sang chảnh - Dubai Fashion,https://www.lazada.vn/products/do-bo-in-nhiet-quan-ao-bong-da-bia-mua-he-nam-nu-unisex-phong-cach-sang-chanh-dubai-fashion-i2264572503.html,65.000 ₫,46% Off,634 Đã bán,(202),Hồ Chí Minh,180.000 ₫,16.500 ₫,3 ngày trả hàng cho Nhà bán hàng,88%,99%,100%,14,6,2,5,175
55,quần áo nam,M56 - BỘ REAL MADRID - QUẦN ÁO THỂ THAO LONG THANH,https://www.lazada.vn/products/m56-bo-real-madrid-quan-ao-the-thao-long-thanh-i2422733111.html,26.350 ₫,25% Off,3.8K Đã bán,(1472),Hồ Chí Minh,31.000 ₫,16.500 ₫,3 ngày trả hàng cho Nhà bán hàng,99%,100%,100%,3,1,3,21,1444
56,quần áo nam,M 49 - Bộ quần áo thể thao Long Thanh - Realmadrid (Trắng-Xđen),https://www.lazada.vn/products/m-49-bo-quan-ao-the-thao-long-thanh-realmadrid-trang-xden-i2584913120.html,25.830 ₫,17% Off,489 Đã bán,(151),Hồ Chí Minh,37.000 ₫,16.500 ₫,3 ngày trả hàng cho Nhà bán hàng,99%,100%,100%,0,2,0,1,148
