,Type,Title,Links,Price,Discount_percent,Sold,Preview,Location,Original,Ship_price,Return,Positive_review,Ship_on_time,Rate_response,One_star,Two_star,Three_star,Four_star,Five_star
57,quần áo nam,[ Voucher Giảm 50% ] Set Bộ Thể Thao Phong Cách Sành Điệu Phối Màu Loang Nổi Bật XƯỞNG MAY THANH NGA MEN QA 086,https://www.lazada.vn/products/voucher-giam-50-set-bo-the-thao-phong-cach-sanh-dieu-phoi-mau-loang-noi-bat-xuong-may-thanh-nga-men-qa-086-i1254644807.html,31.161 ₫,68% Off,743 Đã bán,(311),Hà Nội,98.000 ₫,38.000 ₫,3 ngày trả hàng cho Nhà bán hàng,64%,100%,79%,41,8,7,8,246
58,quần áo nam,M74 - BỘ QUẦN ÁO THỂ THAO - CLB PSG - LONG THANH,https://www.lazada.vn/products/m74-bo-quan-ao-the-thao-clb-psg-long-thanh-i2422744200.html,25.830 ₫,17% Off,1.8K Đã bán,(602),Hồ Chí Minh,31.000 ₫,16.500 ₫,3 ngày trả hàng cho Nhà bán hàng,99%,100%,100%,1,0,3,6,592
59,quần áo nam,"[Freeshipmax] Đồ bộ nam, Bộ thun nam phối quần in chữ Q2, Bộ hè nam cổ tròn chất thun lạnh co dãn 4C",https://www.lazada.vn/products/freeshipmax-do-bo-nam-bo-thun-nam-phoi-quan-in-chu-q2-bo-he-nam-co-tron-chat-thun-lanh-co-dan-4c-i2572106651.html,80.000 ₫,60% Off,38 Đã bán,(10),Hà Nội,199.000 ₫,32.700 ₫,3 ngày trả hàng cho Nhà bán hàng,98%,100%,66%,1,0,0,0,9
60,quần áo nam,"áo thun logo 1992 fom thụng chất cotton siêu mềm ,Form áo unisex nam nữ đều mặc được.ln",https://www.lazada.vn/products/ao-thun-logo-1992-fom-thung-chat-cotton-sieu-mem-form-ao-unisex-nam-nu-deu-mac-duocln-i2208713886.html,52.000 ₫,56% Off,2.6K Đã bán,(691),Hà Nội,119.000 ₫,32.700 ₫,3 ngày trả hàng cho Nhà bán hàng,93%,99%,54%,20,9,22,20,620
61,quần áo nam,M47 - BỘ ARSENAL - QUẦN ÁO THỂ THAO LONG THANH,https://www.lazada.vn/products/m47-bo-arsenal-quan-ao-the-thao-long-thanh-i2422580578.html,25.830 ₫,17% Off,3.4K Đã bán,(1100),Hồ Chí Minh,31.000 ₫,16.500 ₫,3 ngày trả hàng cho Nhà bán hàng,99%,100%,100%,4,1,4,13,1078
62,quần áo nam,Mẫu mới bộ thể thao in hình cá chép hoa đỏ cá tính 4menhcm set nam 9000031,https://www.lazada.vn/products/mau-moi-bo-the-thao-in-hinh-ca-chep-hoa-do-ca-tinh-4menhcm-set-nam-9000031-i2293437208.html,41.000 ₫,70% Off,102 Đã bán,(58),Hà Nội,135.000 ₫,32.700 ₫,3 ngày trả hàng cho Nhà bán hàng,76%,100%,100%,16,0,2,0,41
63,quần áo nam,Áo Cặp - Áo thun nam nữ in hình TS01 độc đẹp vải dày mịn mát,https://www.lazada.vn/products/ao-cap-ao-thun-nam-nu-in-hinh-ts01-doc-dep-vai-day-min-mat-i361442211.html,19.900 ₫,1% Off,1.5K Đã bán,(330),Hồ Chí Minh,35.000 ₫,18.300 ₫,3 ngày trả hàng cho Nhà bán hàng,88%,97%,Không đủ thông tin,55,12,10,10,243
64,quần áo nam,"[FEESHIPMAX] Bộ hè nam BB quần vàng, chất liệu thun lạnh mềm mịn, thiết kế thể thao - Quanaohungha -",https://www.lazada.vn/products/feeshipmax-bo-he-nam-bb-quan-vang-chat-lieu-thun-lanh-mem-min-thiet-ke-the-thao-quanaohungha-i1959398162.html,43.333 ₫,79% Off,35 Đã bán,(10),Hà Nội,205.600 ₫,32.700 ₫,3 ngày trả hàng cho Nhà bán hàng,95%,Không đủ thông tin,100%,1,1,0,0,9
65,quần áo nam,"[FeeshipMax] Đồ bộ nam quần chữ BB vàng, Bộ hè nam chất thun lạnh co dãn 4c phong cách thể thao năng động",https://www.lazada.vn/products/feeshipmax-do-bo-nam-quan-chu-bb-vang-bo-he-nam-chat-thun-lanh-co-dan-4c-phong-cach-the-thao-nang-dong-i1969977140.html,56.000 ₫,66% Off,173 Đã bán,(49),Hà Nội,166.000 ₫,32.700 ₫,3 ngày trả hàng cho Nhà bán hàng,97%,99%,50%,3,0,0,1,45
66,quần áo nam,"Bộ hè nam in chữ D viền vai và viền đùi, bộ quần áo nam chất xịn mặc cực thoải mái thoáng mát mang phong cách trẻ trung thanh lịch có đủ size từ M,L,XL,XXL",https://www.lazada.vn/products/bo-he-nam-in-chu-d-vien-vai-va-vien-dui-bo-quan-ao-nam-chat-xin-mac-cuc-thoai-mai-thoang-mat-mang-phong-cach-tre-trung-thanh-lich-co-du-size-tu-mlxlxxl-i2538077150.html,45.000 ₫,50% Off,171 Đã bán,(107),Hà Nội,90.000 ₫,32.700 ₫,3 ngày trả hàng cho Nhà bán hàng,99%,98%,100%,0,0,0,0,107
67,quần áo nam,"Bộ quần áo nam cổ dệt in chữ IC , bộ hè nam chất xịn mặc cực thoải mái phong cách trẻ trung lịch sự full size cho bạn",https://www.lazada.vn/products/bo-quan-ao-nam-co-det-in-chu-ic-bo-he-nam-chat-xin-mac-cuc-thoai-mai-phong-cach-tre-trung-lich-su-full-size-cho-ban-i2397739846.html,49.000 ₫,46% Off,100 Đã bán,(87),Hà Nội,150.000 ₫,32.700 ₫,3 ngày trả hàng cho Nhà bán hàng,98%,99%,100%,0,0,0,1,86
68,quần áo nam,BỘ THỂ THAO NAM NỮ UNISEX POLO L-NING HOT TREND 2024 - DUBAI FASHION,https://www.lazada.vn/products/bo-the-thao-nam-nu-unisex-polo-l-ning-hot-trend-2024-dubai-fashion-i2533226017.html,57.600 ₫,59% Off,781 Đã bán,(222),Hồ Chí Minh,200.000 ₫,16.500 ₫,3 ngày trả hàng cho Nhà bán hàng,88%,99%,100%,11,3,3,5,200
69,quần áo nam,"[FreeshipMax] Đồ bộ nam, Bộ hè nam in chữ Siêu Đẹp, Chất liệu thun lạnh co dãn 4 chiều",https://www.lazada.vn/products/freeshipmax-do-bo-nam-bo-he-nam-in-chu-sieu-dep-chat-lieu-thun-lanh-co-dan-4-chieu-i2597804468.html,48.000 ₫,76% Off,68 Đã bán,(25),Hà Nội,199.000 ₫,32.700 ₫,3 ngày trả hàng cho Nhà bán hàng,97%,99%,50%,2,0,0,0,23
70,quần áo nam,Bộ hè thun nam cổ dệt in gấu BH19 chất liệu cotton mềm mại thoáng mát co giãn 4 chiều,https://www.lazada.vn/products/bo-he-thun-nam-co-det-in-gau-bh19-chat-lieu-cotton-mem-mai-thoang-mat-co-gian-4-chieu-i2185991514.html,59.000 ₫,34% Off,786 Đã bán,(217),Hà Nội,89.000 ₫,32.700 ₫,3 ngày trả hàng cho Nhà bán hàng,93%,100%,100%,N/A,N/A,N/A,N/A,N/A
71,quần áo nam,[Tặng Vòng Tay Dễ Thương]Đồ bộ thể thao nam thoáng mát mẫu mới phối sọc ngang in chữ DINKBHFKS chất liệu mịn mát thấm hút mồ hôi cực tốt mặc đi chơi tập gym đều đẹp,https://www.lazada.vn/products/tang-vong-tay-de-thuongdo-bo-the-thao-nam-thoang-mat-mau-moi-phoi-soc-ngang-in-chu-dinkbhfks-chat-lieu-min-mat-tham-hut-mo-hoi-cuc-tot-mac-di-choi-tap-gym-deu-dep-i511648631.html,54.880 ₫,45% Off,2.7K Đã bán,(292),Hồ Chí Minh,100.000 ₫,16.500 ₫,3 ngày trả hàng cho Nhà bán hàng,92%,100%,66%,N/A,N/A,N/A,N/A,N/A
72,quần áo nam,"Bộ hè nam thêu chữ DSQ ngực và in vân, bộ quần áo nam chất xịn mặc cực thoải mái thoáng mát mang phong cách trẻ trung thanh lịch có đủ size từ M,L,XL,XXL",https://www.lazada.vn/products/bo-he-nam-theu-chu-dsq-nguc-va-in-van-bo-quan-ao-nam-chat-xin-mac-cuc-thoai-mai-thoang-mat-mang-phong-cach-tre-trung-thanh-lich-co-du-size-tu-mlxlxxl-i2576188759.html,45.000 ₫,50% Off,100 Đã bán,(81),Hà Nội,150.000 ₫,32.700 ₫,3 ngày trả hàng cho Nhà bán hàng,99%,98%,100%,0,0,0,0,81
73,quần áo nam,"[FeeshipMax] Đồ bộ nam, Bộ hè nam quân kẻ Siêu Đẹp, Chất liệu thun lạnh co dãn 4 chiều",https://www.lazada.vn/products/feeshipmax-do-bo-nam-bo-he-nam-quan-ke-sieu-dep-chat-lieu-thun-lanh-co-dan-4-chieu-i2635359318.html,51.000 ₫,68% Off,31 Đã bán,(11),Hà Nội,159.000 ₫,32.700 ₫,3 ngày trả hàng cho Nhà bán hàng,97%,99%,50%,1,0,0,0,10
74,quần áo nam,M90 - BỘ QUẦN ÁO THỂ THAO - LONG THANH,https://www.lazada.vn/products/m90-bo-quan-ao-the-thao-long-thanh-i2491519414.html,26.350 ₫,15% Off,929 Đã bán,(308),Hồ Chí Minh,31.000 ₫,16.500 ₫,3 ngày trả hàng cho Nhà bán hàng,99%,100%,100%,2,0,1,3,303
75,quần áo nam,Quần Áo Nam - Bộ quần Áo Thun Nam Hình Con Mèo,https://www.lazada.vn/products/quan-ao-nam-bo-quan-ao-thun-nam-hinh-con-meo-i1952765712.html,69.000 ₫,37% Off,66 Đã bán,(14),Nam Định,110.000 ₫,37.700 ₫,3 ngày trả hàng cho Nhà bán hàng,95%,100%,100%,0,0,0,2,13
76,quần áo nam,Bộ đồ nam BH18 bộ hè chất liệu thun lạnh co dãn thoáng mát,https://www.lazada.vn/products/bo-do-nam-bh18-bo-he-chat-lieu-thun-lanh-co-dan-thoang-mat-i2394855610.html,49.000 ₫,58% Off,737 Đã bán,(255),Hà Nội,138.000 ₫,32.700 ₫,3 ngày trả hàng cho Nhà bán hàng,93%,100%,100%,6,5,5,6,234
77,quần áo nam,ĐỒ BỘ THỂ THAO VẠN LÝ TRƯỜNG THÀNH NEW SET ĐỒ BỘ THỂ THAO ĐỒ BỘ TẬP GYM MANG Ở NHÀ VÀ ĐI CHƠI ĐỒ BỘ NAM PHONG CÁCH HOT TREND - DUBAI FASHION,https://www.lazada.vn/products/do-bo-the-thao-van-ly-truong-thanh-new-set-do-bo-the-thao-do-bo-tap-gym-mang-o-nha-va-di-choi-do-bo-nam-phong-cach-hot-trend-dubai-fashion-i2390216322.html,44.000 ₫,45% Off,1.1K Đã bán,(363),Hồ Chí Minh,160.000 ₫,16.500 ₫,3 ngày trả hàng cho Nhà bán hàng,88%,99%,100%,43,8,17,17,279
78,quần áo nam,Bộ Thể Thao Nam Polo Cao Cấp Chất Thun Cá Sấu Co Giãn Xưởng May Phong Dũng MQA 049,https://www.lazada.vn/products/bo-the-thao-nam-polo-cao-cap-chat-thun-ca-sau-co-gian-xuong-may-phong-dung-mqa-049-i2576900351.html,32.845 ₫,66% Off,42 Đã bán,(39),Hà Nội,98.000 ₫,38.000 ₫,3 ngày trả hàng cho Nhà bán hàng,73%,100%,77%,0,1,0,0,38
79,quần áo nam,"Bộ quần áo nam mùa hè DSQ11, chất thun lạnh mịn, không xù",https://www.lazada.vn/products/bo-quan-ao-nam-mua-he-dsq11-chat-thun-lanh-min-khong-xu-i2601201205.html,48.000 ₫,68% Off,15 Đã bán,(7),Hà Nội,150.000 ₫,32.700 ₫,3 ngày trả hàng cho Nhà bán hàng,85%,98%,66%,0,1,0,1,5
80,quần áo nam,Xả Kho Nhặt Đồ Vải Modal Vải Thun Lạnh Ngắn Tay Áo Phông Trang Phục Nam Áo Mặc Trong Màu Trơn Mùa Hè Áo Áo Thấm Mồ Hôi Áo Thời Trang,https://www.lazada.vn/products/xa-kho-nhat-do-vai-modal-vai-thun-lanh-ngan-tay-ao-phong-trang-phuc-nam-ao-mac-trong-mau-tron-mua-he-ao-ao-tham-mo-hoi-ao-thoi-trang-i2499505909.html,64.400 ₫,77% Off,198 Đã bán,(48),Hồ Chí Minh,235.000 ₫,17.000 ₫,Không áp dụng chính sách bảo hành,93%,96%,100%,0,0,6,6,36
81,quần áo nam,Bộ Đồ Thường Ngày Cho Nam Bộ Hai Chiếc Cỡ Lớn Bộ Đồ Thể Thao Quần Lửng Tay Ngắn Mùa Hè Cho Nam Vải Viscose Rộng Rãi,https://www.lazada.vn/products/bo-do-thuong-ngay-cho-nam-bo-hai-chiec-co-lon-bo-do-the-thao-quan-lung-tay-ngan-mua-he-cho-nam-vai-viscose-rong-rai-i1852201910.html,33.120 ₫,58% Off,1.5K Đã bán,(323),Hồ Chí Minh,81.000 ₫,17.000 ₫,Không áp dụng chính sách bảo hành,93%,96%,100%,11,8,12,15,278
82,quần áo nam,Quần JEANS 4 Vạch Trắng Nam Quần bò nam Thom 4 sọc Trơn Phối Dập Kẻ Trắng Đùi Cực Đẹp Xưởng May Thanh Nga MQK 018,https://www.lazada.vn/products/quan-jeans-4-vach-trang-nam-quan-bo-nam-thom-4-soc-tron-phoi-dap-ke-trang-dui-cuc-dep-xuong-may-thanh-nga-mqk-018-i2510837060.html,31.161 ₫,68% Off,484 Đã bán,(218),Hà Nội,98.000 ₫,38.000 ₫,3 ngày trả hàng cho Nhà bán hàng,64%,100%,79%,53,11,2,1,152
83,quần áo nam,Bộ thun nam cổ tròn mặc hè chất liệu vân gạo dập nổi cao cấp phong cách trẻ trung Mway MQA 053,https://www.lazada.vn/products/bo-thun-nam-co-tron-mac-he-chat-lieu-van-gao-dap-noi-cao-cap-phong-cach-tre-trung-mway-mqa-053-i2592474681.html,37.899 ₫,61% Off,7 Đã bán,(1),Hà Nội,98.000 ₫,38.000 ₫,3 ngày trả hàng cho Nhà bán hàng,62%,100%,75%,1,0,0,0,0
84,quần áo nam,Xả Kho Nhặt Rò Rỉ Bộ Đồ Biến Đổi Nhanh Khô Lụa Băng Áo Phông Tay Ngắn Cho Nam Bộ Đồ Hai Chiếc Thể Thao Thường Ngày Trang Phục Nam Đẹp Trai,https://www.lazada.vn/products/xa-kho-nhat-ro-ri-bo-do-bien-doi-nhanh-kho-lua-bang-ao-phong-tay-ngan-cho-nam-bo-do-hai-chiec-the-thao-thuong-ngay-trang-phuc-nam-dep-trai-i2475516688.html,57.040 ₫,94% Off,15 Đã bán,(3),Hồ Chí Minh,896.000 ₫,17.000 ₫,Không áp dụng chính sách bảo hành,95%,93%,99%,0,0,1,0,2
85,quần áo nam,"[FeeshipMax] Bộ hè nam, Bộ thun NYY chất liệu mềm mịn co dãn 4C, Phong cách thể thao",https://www.lazada.vn/products/feeshipmax-bo-he-nam-bo-thun-nyy-chat-lieu-mem-min-co-dan-4c-phong-cach-the-thao-i2147211176.html,45.000 ₫,67% Off,13 Đã bán,(4),Hà Nội,136.000 ₫,32.700 ₫,3 ngày trả hàng cho Nhà bán hàng,95%,100%,100%,0,0,0,0,4
86,quần áo nam,ĐỒ BỘ THỂ THAO CHỮ DONT .STOP DÀI NAM SET ĐỒ BỘ THỂ THAO ĐỒ BỘ TẬP GYM MANG Ở NHÀ VÀ ĐI CHƠI ĐỒ BỘ NAM PHONG CÁCH SÀNH ĐIỆU - TOKYO FASHION,https://www.lazada.vn/products/do-bo-the-thao-chu-dont-stop-dai-nam-set-do-bo-the-thao-do-bo-tap-gym-mang-o-nha-va-di-choi-do-bo-nam-phong-cach-sanh-dieu-tokyo-fashion-i2366471018.html,35.000 ₫,56% Off,293 Đã bán,(86),Hồ Chí Minh,150.000 ₫,16.500 ₫,3 ngày trả hàng cho Nhà bán hàng,88%,100%,98%,7,3,4,4,69
87,quần áo nam,ĐỒ BỘ THỂ THAO EM BÉ SPACE PHOM FORM RỘNG 2023 SET ĐỒ BỘ THỂ THAO ĐỒ BỘ TẬP GYM. CHƠI BÓNG RỔ MANG Ở NHÀ VÀ ĐI CHƠI ĐỒ BỘ NAM PHONG CÁCH HOT TREND MÙA HÈ- DUBAI FASHION,https://www.lazada.vn/products/do-bo-the-thao-em-be-space-phom-form-rong-2023-set-do-bo-the-thao-do-bo-tap-gym-choi-bong-ro-mang-o-nha-va-di-choi-do-bo-nam-phong-cach-hot-trend-mua-he-dubai-fashion-i1911744300.html,32.000 ₫,54% Off,520 Đã bán,(117),Hồ Chí Minh,140.000 ₫,16.500 ₫,3 ngày trả hàng cho Nhà bán hàng,88%,99%,100%,N/A,N/A,N/A,N/A,N/A
88,quần áo nam,Áo Phông Nam Tay Ngắn Mùa Hè Áo Phông Mặc Trong Tay Lửng Túi Cá Tính Hoạt Hình Vải Viscose Mẫu Mới Năm 2022 Trang Phục Nam Áo,https://www.lazada.vn/products/ao-phong-nam-tay-ngan-mua-he-ao-phong-mac-trong-tay-lung-tui-ca-tinh-hoat-hinh-vai-viscose-mau-moi-nam-2022-trang-phuc-nam-ao-i1992990331.html,32.200 ₫,92% Off,8 Đã bán,(2),Nước ngoài,396.000 ₫,17.000 ₫,Không áp dụng chính sách bảo hành,95%,93%,99%,0,0,0,1,1
89,quần áo nam,"ĐỒ BỘ THỂ THAO HỌA TIẾT CHỮ SUP - CÓ NÓN NHẬT BẢN , SET ĐỒ BỘ THỂ THAO, ĐỒ BỘ TẬP GYM MANG Ở NHÀ VÀ ĐI CHƠI , ĐỒ BỘ NAM PHONG CÁCH CAO CẤP - DUBAI FASHION",https://www.lazada.vn/products/do-bo-the-thao-hoa-tiet-chu-sup-co-non-nhat-ban-set-do-bo-the-thao-do-bo-tap-gym-mang-o-nha-va-di-choi-do-bo-nam-phong-cach-cao-cap-dubai-fashion-i1218430098.html,32.000 ₫,54% Off,625 Đã bán,(141),Hồ Chí Minh,150.000 ₫,16.500 ₫,3 ngày trả hàng cho Nhà bán hàng,88%,99%,100%,11,7,8,7,108
90,quần áo nam,[ Deal Độc Quyền ] Bộ Quần Áo Thun Nam Tay Ngắn Cổ Tròn NEIGHBOR Phối Túi Quần Dây Phong Cách Cá Tính Sành Điệu Cực Chất NTD QA NAM 080,https://www.lazada.vn/products/deal-doc-quyen-bo-quan-ao-thun-nam-tay-ngan-co-tron-neighbor-phoi-tui-quan-day-phong-cach-ca-tinh-sanh-dieu-cuc-chat-ntd-qa-nam-080-i590802155.html,37.899 ₫,66% Off,219 Đã bán,(106),Hà Nội,110.000 ₫,38.000 ₫,3 ngày trả hàng cho Nhà bán hàng,69%,100%,82%,22,2,3,0,79
91,quần áo nam,M 97 - QUẦN ÁO THỂ THAO - LONG THANH - BRASIL,https://www.lazada.vn/products/m-97-quan-ao-the-thao-long-thanh-brasil-i2547480149.html,25.830 ₫,17% Off,508 Đã bán,(177),Hồ Chí Minh,41.000 ₫,16.500 ₫,3 ngày trả hàng cho Nhà bán hàng,99%,100%,100%,1,0,0,5,172
92,quần áo nam,Áo thun nam POLO phối màu cotton cao cấp co giãn 4 chiều mềm mịn thoáng mát sang trọng,https://www.lazada.vn/products/ao-thun-nam-polo-phoi-mau-cotton-cao-cap-co-gian-4-chieu-mem-min-thoang-mat-sang-trong-i2629691055.html,69.000 ₫,43% Off,177 Đã bán,(75),Hồ Chí Minh,120.000 ₫,16.500 ₫,3 ngày trả hàng cho Nhà bán hàng,Nhà bán hàng mới,98%,85%,0,0,0,0,75
93,quần áo nam,[ Hoàn Tiền 15% ] Set Bộ Quần Áo Thun Hè Nam Mẫu Mới In Họa Tiết Chữ LXSU Phối Màu Phong Cách Thời Trang Shiny Sunday MEN QA 129 V2,https://www.lazada.vn/products/hoan-tien-15-set-bo-quan-ao-thun-he-nam-mau-moi-in-hoa-tiet-chu-lxsu-phoi-mau-phong-cach-thoi-trang-shiny-sunday-men-qa-129-v2-i2032125887.html,32.845 ₫,58% Off,258 Đã bán,(121),Hà Nội,78.000 ₫,38.000 ₫,3 ngày trả hàng cho Nhà bán hàng,68%,100%,82%,16,0,0,2,103
94,quần áo nam,[ Deal Độc Quyền ] Bộ Quần Áo Nam Mùa Hè Sành Điệu Phong Cách Đường Phố Trẻ Trung Cá Tính NTD MEN QA 098,https://www.lazada.vn/products/deal-doc-quyen-bo-quan-ao-nam-mua-he-sanh-dieu-phong-cach-duong-pho-tre-trung-ca-tinh-ntd-men-qa-098-i1169392978.html,31.161 ₫,68% Off,1.4K Đã bán,(609),Hà Nội,98.000 ₫,38.000 ₫,3 ngày trả hàng cho Nhà bán hàng,69%,100%,82%,60,15,14,6,515
95,quần áo nam,Bộ Thể Thao Nam Cổ Tròn Tay Ngắn Chất Liệu Thun Lạnh Coolmax Thấm Hút Mồ Hôi Tốt Full size 45-95kg,https://www.lazada.vn/products/bo-the-thao-nam-co-tron-tay-ngan-chat-lieu-thun-lanh-coolmax-tham-hut-mo-hoi-tot-full-size-45-95kg-i2328513210.html,85.000 ₫,53% Off,62 Đã bán,(12),Hà Nội,180.000 ₫,32.700 ₫,3 ngày trả hàng cho Nhà bán hàng,96%,92%,80%,1,0,0,0,11
96,quần áo nam,M73 - BỘ QUẦN ÁO THỂ THAO - CLB PSG - LONG THANH,https://www.lazada.vn/products/m73-bo-quan-ao-the-thao-clb-psg-long-thanh-i2422681266.html,26.350 ₫,15% Off,2.8K Đã bán,(915),Hồ Chí Minh,31.000 ₫,16.500 ₫,3 ngày trả hàng cho Nhà bán hàng,99%,100%,100%,1,1,6,7,900
97,quần áo nam,ĐỒ BỘ THỂ THAO CHỮ DONT .STOP DÀI NAM SET ĐỒ BỘ THỂ THAO ĐỒ BỘ TẬP GYM MANG Ở NHÀ VÀ ĐI CHƠI ĐỒ BỘ NAM PHONG CÁCH SANG CHÀNH - DUBAI FASHION,https://www.lazada.vn/products/do-bo-the-thao-chu-dont-stop-dai-nam-set-do-bo-the-thao-do-bo-tap-gym-mang-o-nha-va-di-choi-do-bo-nam-phong-cach-sang-chanh-dubai-fashion-i2366314434.html,37.000 ₫,54% Off,641 Đã bán,(216),Hồ Chí Minh,150.000 ₫,16.500 ₫,3 ngày trả hàng cho Nhà bán hàng,88%,99%,100%,16,3,4,5,189
98,quần áo nam,"[FeeshipMax] Đồ bộ nam hè B.T, chất liệu thun lạnh 4 chiều, phong cách thể thao",https://www.lazada.vn/products/feeshipmax-do-bo-nam-he-bt-chat-lieu-thun-lanh-4-chieu-phong-cach-the-thao-i2144558310.html,78.000 ₫,53% Off,222 Đã bán,(76),Hà Nội,166.000 ₫,32.700 ₫,3 ngày trả hàng cho Nhà bán hàng,97%,99%,50%,1,0,0,2,73
99,quần áo nam,[Freeship MAX] Bộ Quần Áo Thun Nam Ngắn Tay Họa Tiết BigSmits Phối Quần Short Đùi Túi Vuông Phong Cách Trẻ Trung Cá Tính Sành Điệu Rich Man MEN QA 085,https://www.lazada.vn/products/freeship-max-bo-quan-ao-thun-nam-ngan-tay-hoa-tiet-bigsmits-phoi-quan-short-dui-tui-vuong-phong-cach-tre-trung-ca-tinh-sanh-dieu-rich-man-men-qa-085-i1242041926.html,32.845 ₫,66% Off,1.3K Đã bán,(716),Hà Nội,98.000 ₫,38.000 ₫,3 ngày trả hàng cho Nhà bán hàng,66%,100%,81%,65,9,6,5,632
100,quần áo nam,[ Hoàn Tiền Max ] Bộ Quần Áo Thun Nam Ngắn Tay Thời Trang In Họa Tiết Núi Đồi Kèm Chữ ASTOYO Tinh Tế Basic BONBON MEN QA 163,https://www.lazada.vn/products/hoan-tien-max-bo-quan-ao-thun-nam-ngan-tay-thoi-trang-in-hoa-tiet-nui-doi-kem-chu-astoyo-tinh-te-basic-bonbon-men-qa-163-i1699808581.html,49.000 ₫,50% Off,431 Đã bán,(261),Hà Nội,98.000 ₫,38.000 ₫,3 ngày trả hàng cho Nhà bán hàng,69%,100%,66%,25,1,2,1,233
101,quần áo nam,"[FeeshipMax] Đồ bộ nam, Bộ hè nam DIIIOR Gấu Dập Nổi, Chất liệu thun 4 chiều, Phong cách thể thao",https://www.lazada.vn/products/feeshipmax-do-bo-nam-bo-he-nam-diiior-gau-dap-noi-chat-lieu-thun-4-chieu-phong-cach-the-thao-i2383073122.html,81.793 ₫,59% Off,223 Đã bán,(71),Hà Nội,199.000 ₫,32.700 ₫,3 ngày trả hàng cho Nhà bán hàng,97%,99%,50%,0,0,1,0,70
102,quần áo nam,"ĐỒ BỘ THỂ THAO HARARD NEW , SET ĐỒ BỘ THỂ THAO, ĐỒ BỘ TẬP GYM MANG Ở NHÀ VÀ ĐI CHƠI , ĐỒ BỘ NAM PHONG CÁCH SÀNH ĐIỆU VIP - DUBAI FASHION",https://www.lazada.vn/products/do-bo-the-thao-harard-new-set-do-bo-the-thao-do-bo-tap-gym-mang-o-nha-va-di-choi-do-bo-nam-phong-cach-sanh-dieu-vip-dubai-fashion-i2020707337.html,31.000 ₫,56% Off,263 Đã bán,(68),Hồ Chí Minh,150.000 ₫,16.500 ₫,3 ngày trả hàng cho Nhà bán hàng,88%,99%,100%,N/A,N/A,N/A,N/A,N/A
103,quần áo nam,[ Hoàn Tiền 15% ] Combo Set Bộ Đồ Hè Nam Áo Thun Ngắn Tay Cổ Tròn Họa Tiết Vảy Sơn Phối Màu Loang Kết Hợp Quần Shorts Đùi Lưng Chun Phong Cách Trẻ Trung Cá Tính Năng Động SOYOUNG VN MEN TOP 220 + SHORTS 050,https://www.lazada.vn/products/hoan-tien-15-combo-set-bo-do-he-nam-ao-thun-ngan-tay-co-tron-hoa-tiet-vay-son-phoi-mau-loang-ket-hop-quan-shorts-dui-lung-chun-phong-cach-tre-trung-ca-tinh-nang-dong-soyoung-vn-men-top-220-shorts-050-i1388849099.html,32.657 ₫,67% Off,705 Đã bán,(350),Hà Nội,98.000 ₫,38.000 ₫,3 ngày trả hàng cho Nhà bán hàng,65%,100%,79%,57,5,3,2,284
104,quần áo nam,Áo Thun Nam Loang Màu In Họa Tiết Hoạt Hình Ngộ Nghĩnh Dáng Basic Phù Hợp Với Mọi Lứa Tuổi Thời Trang Mùa Hè 2024 FORHIMCS2 AO TOP NAM 90000182,https://www.lazada.vn/products/ao-thun-nam-loang-mau-in-hoa-tiet-hoat-hinh-ngo-nghinh-dang-basic-phu-hop-voi-moi-lua-tuoi-thoi-trang-mua-he-2024-forhimcs2-ao-top-nam-90000182-i1298726337.html,26.000 ₫,80% Off,1.3K Đã bán,(564),Hà Nội,129.000 ₫,32.700 ₫,3 ngày trả hàng cho Nhà bán hàng,75%,100%,100%,41,5,15,10,493
105,quần áo nam,"Bộ hè nam phối viền vai và viền quần chữ, bộ hè nam chất xịn mặc cực thoải mái phong cách trẻ trung lịch sự full size cho bạn",https://www.lazada.vn/products/bo-he-nam-phoi-vien-vai-va-vien-quan-chu-bo-he-nam-chat-xin-mac-cuc-thoai-mai-phong-cach-tre-trung-lich-su-full-size-cho-ban-i2537921875.html,47.000 ₫,48% Off,89 Đã bán,(78),Hà Nội,90.000 ₫,32.700 ₫,3 ngày trả hàng cho Nhà bán hàng,99%,99%,100%,0,0,0,0,78
106,quần áo nam,[ Deal Độc Quyền ] Bộ Quần Áo Khoác Nhẹ Nỉ Thu Đông Năng Động Nam Họa Tiết Chữ HDA Phối Quần Jogger Cạp Chun Mway MEN QA 022,https://www.lazada.vn/products/deal-doc-quyen-bo-quan-ao-khoac-nhe-ni-thu-dong-nang-dong-nam-hoa-tiet-chu-hda-phoi-quan-jogger-cap-chun-mway-men-qa-022-i1975711969.html,63.000 ₫,65% Off,904 Đã bán,(536),Hà Nội,178.000 ₫,38.000 ₫,3 ngày trả hàng cho Nhà bán hàng,62%,100%,75%,42,4,6,2,482
107,quần áo nam,[ Giảm Giá Sốc ] Bộ Quần Áo Thun Nam Áo Ngắn Tay Cổ Tròn Họa Tiết Shin Cậu Bé Bút Chì Mẫu Hot 2023 Phong Cách Trẻ Trung Cá Tính Năng Động HHH MEN QA 155,https://www.lazada.vn/products/giam-gia-soc-bo-quan-ao-thun-nam-ao-ngan-tay-co-tron-hoa-tiet-shin-cau-be-but-chi-mau-hot-2023-phong-cach-tre-trung-ca-tinh-nang-dong-hhh-men-qa-155-i1527882386.html,49.000 ₫,50% Off,366 Đã bán,(231),Hà Nội,98.000 ₫,38.000 ₫,3 ngày trả hàng cho Nhà bán hàng,75%,100%,73%,14,1,4,0,212
108,quần áo nam,Bộ Quần Áo Thun Nam 24 Áo Thun Ba Lỗ Sát Nách Kết Hợp Quần Shorts Trơn Có Túi Hot Trend 2024 Thời Trang FASHION4MEN SET NAM 90000160,https://www.lazada.vn/products/bo-quan-ao-thun-nam-24-ao-thun-ba-lo-sat-nach-ket-hop-quan-shorts-tron-co-tui-hot-trend-2024-thoi-trang-fashion4men-set-nam-90000160-i1218663565.html,40.000 ₫,65% Off,1.4K Đã bán,(414),Hà Nội,155.000 ₫,32.700 ₫,3 ngày trả hàng cho Nhà bán hàng,74%,100%,97%,55,13,23,14,309
109,quần áo nam,Bộ Đồ Thun Nam Hot Trend Mùa Hè Năm 2024 Gấu Phối Sọc Đơn Giản Trẻ Trung Áo Ngắn Tay Cổ Tròn Kết Hợp Quần Shorts Đùi 4MEN SET NAM 90000161C3,https://www.lazada.vn/products/bo-do-thun-nam-hot-trend-mua-he-nam-2024-gau-phoi-soc-don-gian-tre-trung-ao-ngan-tay-co-tron-ket-hop-quan-shorts-dui-4men-set-nam-90000161c3-i1270741075.html,45.000 ₫,71% Off,1.3K Đã bán,(467),Hà Nội,115.000 ₫,32.700 ₫,3 ngày trả hàng cho Nhà bán hàng,74%,100%,97%,47,8,7,7,399
110,quần áo nam,[Tặng Vòng Tay Dễ Thương]Đồ bộ thể thao nam mùa Hè chất thun mềm mịn thoáng mát đồ bộ thể thao nam tập gym đi đá bóng hay đi chơi bóng rỗ đều được,https://www.lazada.vn/products/tang-vong-tay-de-thuongdo-bo-the-thao-nam-mua-he-chat-thun-mem-min-thoang-mat-do-bo-the-thao-nam-tap-gym-di-da-bong-hay-di-choi-bong-ro-deu-duoc-i466688393.html,41.537 ₫,58% Off,2.7K Đã bán,(406),Hồ Chí Minh,100.000 ₫,16.500 ₫,3 ngày trả hàng cho Nhà bán hàng,92%,100%,66%,N/A,N/A,N/A,N/A,N/A
111,quần áo nam,Bộ Quần Áo Thun Nam Mùa Hè Phối Sọc Viền Đơn Giản Trẻ Trung Áo Ngắn Tay Cổ Tròn Kết Hợp Quần Shorts Đùi Hot Trend 2024 4MEN SET NAM 90000161C2,https://www.lazada.vn/products/bo-quan-ao-thun-nam-mua-he-phoi-soc-vien-don-gian-tre-trung-ao-ngan-tay-co-tron-ket-hop-quan-shorts-dui-hot-trend-2024-4men-set-nam-90000161c2-i1270620367.html,48.000 ₫,69% Off,331 Đã bán,(141),Hà Nội,155.000 ₫,32.700 ₫,3 ngày trả hàng cho Nhà bán hàng,74%,100%,97%,15,4,0,0,120
112,quần áo nam,Áo phông nam nữ cổ tròn Dsq2 in hoạ tiết chữ ICON vảy sơn 7 màu siêu rẻ đẹp boy phố,https://www.lazada.vn/products/ao-phong-nam-nu-co-tron-dsq2-in-hoa-tiet-chu-icon-vay-son-7-mau-sieu-re-dep-boy-pho-i2571126073.html,54.700 ₫,58% Off,168 Đã bán,(54),Hà Nội,130.000 ₫,32.700 ₫,3 ngày trả hàng cho Nhà bán hàng,95%,100%,85%,1,0,0,3,51
113,quần áo nam,"Bộ hè nam in ic và in lá áo và quần, bộ quần áo nam chất xịn mặc cực thoải mái thoáng mát mang phong cách trẻ trung thanh lịch có đủ size từ M,L,XL,XXL",https://www.lazada.vn/products/bo-he-nam-in-ic-va-in-la-ao-va-quan-bo-quan-ao-nam-chat-xin-mac-cuc-thoai-mai-thoang-mat-mang-phong-cach-tre-trung-thanh-lich-co-du-size-tu-mlxlxxl-i2642321676.html,41.449 ₫,54% Off,20 Đã bán,(18),Hà Nội,150.000 ₫,32.700 ₫,3 ngày trả hàng cho Nhà bán hàng,99%,98%,100%,0,0,0,0,19
