,Type,Title,Links,Price,Discount_percent,Sold,Preview,Location,Original,Ship_price,Return,Positive_review,Ship_on_time,Rate_response,One_star,Two_star,Three_star,Four_star,Five_star
114,quần áo nam,"Bộ Cộc Tay Nam Nữ Mùa Hè In Chữ Thập Phong Cách Trẻ Trung, Bộ Thể Thao Nam Chất Tổ Ong BO18 - MINHSTORE 66",https://www.lazada.vn/products/bo-coc-tay-nam-nu-mua-he-in-chu-thap-phong-cach-tre-trung-bo-the-thao-nam-chat-to-ong-bo18-minhstore-66-i2592303067.html,129.000 ₫,57% Off,297 Đã bán,(80),Hà Nội,300.000 ₫,38.000 ₫,3 ngày trả hàng cho Nhà bán hàng,96%,99%,94%,1,1,1,3,74
115,quần áo nam,"Bộ quần áo thể thao nam, đồ tập gym thể thao vải thun lạnh cao cấp BTT01",https://www.lazada.vn/products/bo-quan-ao-the-thao-nam-do-tap-gym-the-thao-vai-thun-lanh-cao-cap-btt01-i2115453516.html,53.258 ₫,47% Off,1.5K Đã bán,(281),Hồ Chí Minh,100.000 ₫,16.500 ₫,3 ngày trả hàng cho Nhà bán hàng,94%,85%,100%,26,15,4,5,232
116,quần áo nam,HOÀN TIỀN 15% - Bộ Đồ Thun Nam Áo Hoodies Túi Hộp Khoá Phối Họa Tiết Rằn Ri Kết Hợp Quần Jogger Phối Dây Chữ Trẻ Trung Thời Trang FASHION4MENHCM SET 9000089,https://www.lazada.vn/products/hoan-tien-15-bo-do-thun-nam-ao-hoodies-tui-hop-khoa-phoi-hoa-tiet-ran-ri-ket-hop-quan-jogger-phoi-day-chu-tre-trung-thoi-trang-fashion4menhcm-set-9000089-i1169850072.html,71.000 ₫,75% Off,2.6K Đã bán,(810),Hà Nội,285.000 ₫,32.700 ₫,3 ngày trả hàng cho Nhà bán hàng,76%,100%,100%,105,17,18,37,633
117,quần áo nam,[ Voucher Giảm 50% ] Bộ quần áo thun nam Bộ quần áo thun nữ Bộ quần áo thun unisex in chữ PTBOY cực đẹp phong cách đường phố trẻ trung năng động Shiny Sunday MQA 013,https://www.lazada.vn/products/voucher-giam-50-bo-quan-ao-thun-nam-bo-quan-ao-thun-nu-bo-quan-ao-thun-unisex-in-chu-ptboy-cuc-dep-phong-cach-duong-pho-tre-trung-nang-dong-shiny-sunday-mqa-013-i2255158222.html,32.845 ₫,66% Off,13 Đã bán,(4),Hà Nội,98.000 ₫,38.000 ₫,3 ngày trả hàng cho Nhà bán hàng,68%,100%,82%,1,0,0,0,3
118,quần áo nam,ĐỒ BỘ QUẦN ÁO NAM THỂ THAO MÙA HÈ POLO CHẤT THUN CÁ SẤU CO GIÃN PHONG CÁCH HOT TREND 2024 - DUBAI FASHION,https://www.lazada.vn/products/do-bo-quan-ao-nam-the-thao-mua-he-polo-chat-thun-ca-sau-co-gian-phong-cach-hot-trend-2024-dubai-fashion-i2633081408.html,69.000 ₫,54% Off,10 Đã bán,(5),Hồ Chí Minh,200.000 ₫,16.500 ₫,3 ngày trả hàng cho Nhà bán hàng,88%,99%,100%,N/A,N/A,N/A,N/A,N/A
119,quần áo nam,Bộ Quần Áo Thun Thể Thao Nam Họa Tiết Ba Vạch Nhỏ Dáng Basic Trẻ Trung Thời Trang Cá Tính Năng Động - Top1shop 01,https://www.lazada.vn/products/bo-quan-ao-thun-the-thao-nam-hoa-tiet-ba-vach-nho-dang-basic-tre-trung-thoi-trang-ca-tinh-nang-dong-top1shop-01-i1322623764.html,19.369 ₫,88% Off,2.4K Đã bán,(440),Hồ Chí Minh,159.000 ₫,16.500 ₫,3 ngày trả hàng cho Nhà bán hàng,92%,98%,100%,N/A,N/A,N/A,N/A,N/A
